<?xml version="1.0" ?><axmlt:policybase xmlns:axmlt="scm.uws.edu.au" xmlns:xsi="http://www.w3.org/2001/XMLSchema-instance" xsi:schemaLocation="scm.uws.edu.au axmlt_policybase.xsd ">
  
    
      
  
            
<axmlt:rule><axmlt:head-statement><axmlt:role-statement><axmlt:role-name>volunteer</axmlt:role-name><axmlt:sign>pp</axmlt:sign><axmlt:xpath-statement><axmlt:document-name>nutrition</axmlt:document-name><axmlt:xpath-expression>//carb</axmlt:xpath-expression></axmlt:xpath-statement><axmlt:privilege>read</axmlt:privilege></axmlt:role-statement></axmlt:head-statement></axmlt:rule><axmlt:rule><axmlt:head-statement><axmlt:role-statement><axmlt:role-name>employee</axmlt:role-name><axmlt:sign>pp</axmlt:sign><axmlt:xpath-statement><axmlt:document-name>nutrition</axmlt:document-name><axmlt:xpath-expression>/</axmlt:xpath-expression></axmlt:xpath-statement><axmlt:privilege>read</axmlt:privilege></axmlt:role-statement></axmlt:head-statement></axmlt:rule><axmlt:rule><axmlt:head-statement><axmlt:relationship-statement><axmlt:below><axmlt:value1>nutritionist</axmlt:value1><axmlt:value2>employee</axmlt:value2></axmlt:below></axmlt:relationship-statement></axmlt:head-statement></axmlt:rule><axmlt:rule><axmlt:head-statement><axmlt:role-statement><axmlt:role-name>nutritionist</axmlt:role-name><axmlt:sign>pp</axmlt:sign><axmlt:xpath-statement><axmlt:document-name>nutrition</axmlt:document-name><axmlt:xpath-expression>/</axmlt:xpath-expression></axmlt:xpath-statement><axmlt:privilege>write</axmlt:privilege></axmlt:role-statement></axmlt:head-statement></axmlt:rule><axmlt:rule><axmlt:head-statement><axmlt:role-statement><axmlt:role-name>volunteer</axmlt:role-name><axmlt:sign>pp</axmlt:sign><axmlt:xpath-statement><axmlt:document-name>nutrition</axmlt:document-name><axmlt:xpath-expression>//calories[@fat='100']</axmlt:xpath-expression></axmlt:xpath-statement><axmlt:privilege>read</axmlt:privilege></axmlt:role-statement></axmlt:head-statement></axmlt:rule><axmlt:rule><axmlt:head-statement><axmlt:relationship-statement><axmlt:separate><axmlt:value1>nutritionist</axmlt:value1><axmlt:value2>employee</axmlt:value2></axmlt:separate></axmlt:relationship-statement></axmlt:head-statement></axmlt:rule><axmlt:rule><axmlt:head-statement><axmlt:grant-statement><axmlt:role-name>nutritionist</axmlt:role-name><axmlt:subject>sean</axmlt:subject><axmlt:temporal-interval>monday</axmlt:temporal-interval></axmlt:grant-statement></axmlt:head-statement></axmlt:rule><axmlt:rule><axmlt:head-statement><axmlt:grant-statement><axmlt:role-name>doctor</axmlt:role-name><axmlt:subject>pat</axmlt:subject><axmlt:temporal-interval>wednesday</axmlt:temporal-interval></axmlt:grant-statement></axmlt:head-statement></axmlt:rule><axmlt:rule><axmlt:head-statement><axmlt:role-statement><axmlt:role-name>doctor</axmlt:role-name><axmlt:sign>pp</axmlt:sign><axmlt:xpath-statement><axmlt:document-name>nutrition</axmlt:document-name><axmlt:xpath-expression>/dailyvalues</axmlt:xpath-expression></axmlt:xpath-statement><axmlt:privilege>write</axmlt:privilege></axmlt:role-statement></axmlt:head-statement></axmlt:rule><axmlt:rule><axmlt:head-statement><axmlt:role-statement><axmlt:role-name>nutritionist</axmlt:role-name><axmlt:sign>mm</axmlt:sign><axmlt:xpath-statement><axmlt:document-name>nutrition</axmlt:document-name><axmlt:xpath-expression>/dailyvalues</axmlt:xpath-expression></axmlt:xpath-statement><axmlt:privilege>write</axmlt:privilege></axmlt:role-statement></axmlt:head-statement></axmlt:rule><axmlt:rule><axmlt:head-statement><axmlt:grant-statement><axmlt:role-name>nutritionist</axmlt:role-name><axmlt:subject>pat</axmlt:subject><axmlt:temporal-interval>wednesday</axmlt:temporal-interval></axmlt:grant-statement></axmlt:head-statement></axmlt:rule><axmlt:rule><axmlt:head-statement><axmlt:relationship-statement><axmlt:before><axmlt:value1>monday</axmlt:value1><axmlt:value2>tuesday</axmlt:value2></axmlt:before></axmlt:relationship-statement></axmlt:head-statement></axmlt:rule><axmlt:rule><axmlt:head-statement><axmlt:relationship-statement><axmlt:before><axmlt:value1>tuesday</axmlt:value1><axmlt:value2>wednesday</axmlt:value2></axmlt:before></axmlt:relationship-statement></axmlt:head-statement></axmlt:rule><axmlt:rule><axmlt:head-statement><axmlt:grant-statement><axmlt:role-name>volunteer</axmlt:role-name><axmlt:subject>joel</axmlt:subject><axmlt:temporal-interval>tuesday</axmlt:temporal-interval></axmlt:grant-statement></axmlt:head-statement></axmlt:rule><axmlt:rule><axmlt:head-statement><axmlt:grant-statement><axmlt:role-name>doctor</axmlt:role-name><axmlt:subject>joel</axmlt:subject><axmlt:temporal-interval>friday</axmlt:temporal-interval></axmlt:grant-statement></axmlt:head-statement></axmlt:rule><axmlt:rule><axmlt:head-statement><axmlt:relationship-statement><axmlt:during><axmlt:value1>teatime</axmlt:value1><axmlt:value2>morning</axmlt:value2></axmlt:during></axmlt:relationship-statement></axmlt:head-statement></axmlt:rule></axmlt:policybase>