<?xml version="1.0"?>
<axmlt:policybase xmlns:axmlt="scm.uws.edu.au" xmlns:xsi="http://www.w3.org/2001/XMLSchema-instance" xsi:schemaLocation="scm.uws.edu.au axmlt_policybase.xsd"><axmlt:rule><axmlt:head-statement><axmlt:grant-statement><axmlt:role-name>X</axmlt:role-name><axmlt:subject>Y</axmlt:subject><axmlt:temporal-interval>Z</axmlt:temporal-interval></axmlt:grant-statement></axmlt:head-statement><axmlt:body-statement><axmlt:relationship-statement><axmlt:below><axmlt:value1>X</axmlt:value1><axmlt:value2>A</axmlt:value2></axmlt:below></axmlt:relationship-statement></axmlt:body-statement><axmlt:body-statement><axmlt:relationship-statement><axmlt:during><axmlt:value1>Z</axmlt:value1><axmlt:value2>tuesday</axmlt:value2></axmlt:during></axmlt:relationship-statement></axmlt:body-statement></axmlt:rule></axmlt:policybase>
